{"devices":[{"device_id":"org.hyper-module.native-filter","dsp_version":1,"enabled":true,"extensions":{},"id":"018f47a2-6b2d-7c11-8a44-001122334491","state":{"cutoff_millihertz":1000000,"mode":"low-pass","resonance_millionths":707107},"state_version":1}],"extensions":{},"format":"hyper-device-chain","format_version":1,"id":"018f47a2-6b2d-7c11-8a44-001122334490","project_id":"018f47a2-6b2d-7c11-8a44-001122334455","track_id":"018f47a2-6b2d-7c11-8a44-001122334456"}
